[
  {
    "id": "genesis",
    "type": "book",
    "name": "Genesis",
    "startYear": 4000,
    "endYear": 1805,
    "certainty": "approximate",
    "categories": [
      "Pentateuch"
    ],
    "themes": [],
    "priority": 1,
    "author": "Moses (traditional)",
    "description": "Creation, Fall, Flood, Patriarchs",
    "sources": [
      "Hindson & Yates, The Essence of the Old Testament (B&H Academic, 2012)",
      "Walton, Chronological and Background Charts of the Old Testament (Zondervan, 1994)"
    ],
    "swimlane": 0
  },
  {
    "id": "exodus-book",
    "type": "book",
    "name": "Exodus",
    "startYear": 1446,
    "endYear": 1406,
    "certainty": "approximate",
    "categories": [
      "Pentateuch"
    ],
    "themes": [],
    "priority": 1,
    "author": "Moses",
    "description": "Israel's deliverance from Egypt and receiving the Law at Sinai",
    "sources": [
      "Hindson & Yates, The Essence of the Old Testament (B&H Academic, 2012)",
      "Walton, Chronological and Background Charts of the Old Testament (Zondervan, 1994)"
    ],
    "swimlane": 0
  },
  {
    "id": "leviticus",
    "type": "book",
    "name": "Leviticus",
    "startYear": 1446,
    "endYear": 1406,
    "certainty": "approximate",
    "categories": [
      "Pentateuch"
    ],
    "themes": [],
    "priority": 2,
    "author": "Moses",
    "description": "Laws for holiness, worship, sacrifices, and priestly ministry.",
    "sources": [
      "Hindson & Yates, The Essence of the Old Testament (B&H Academic, 2012)",
      "Walton, Chronological and Background Charts of the Old Testament (Zondervan, 1994)"
    ],
    "swimlane": 1
  },
  {
    "id": "numbers",
    "type": "book",
    "name": "Numbers",
    "startYear": 1446,
    "endYear": 1406,
    "certainty": "approximate",
    "categories": [
      "Pentateuch"
    ],
    "themes": [],
    "priority": 2,
    "author": "Moses",
    "description": "Wilderness journey, censuses, rebellion, and preparation to enter Canaan.",
    "sources": [
      "Hindson & Yates, The Essence of the Old Testament (B&H Academic, 2012)",
      "Walton, Chronological and Background Charts of the Old Testament (Zondervan, 1994)"
    ],
    "swimlane": 2
  },
  {
    "id": "deuteronomy",
    "type": "book",
    "name": "Deuteronomy",
    "startYear": 1406,
    "endYear": 1406,
    "certainty": "approximate",
    "categories": [
      "Pentateuch"
    ],
    "themes": [],
    "priority": 2,
    "author": "Moses",
    "description": "Moses final covenant sermons before Israel enters the land.",
    "sources": [
      "Hindson & Yates, The Essence of the Old Testament (B&H Academic, 2012)",
      "Walton, Chronological and Background Charts of the Old Testament (Zondervan, 1994)"
    ],
    "swimlane": 3
  },
  {
    "id": "1-samuel",
    "type": "book",
    "name": "1 Samuel",
    "startYear": 1100,
    "endYear": 1010,
    "certainty": "approximate",
    "categories": [
      "History"
    ],
    "themes": [],
    "priority": 2,
    "author": "Samuel, Gad, Nathan (traditional)",
    "description": "Transition from judges to monarchy; Saul reign and David rise.",
    "sources": [
      "Hindson & Yates, The Essence of the Old Testament (B&H Academic, 2012)",
      "Walton, Chronological and Background Charts of the Old Testament (Zondervan, 1994)"
    ],
    "swimlane": 2
  },
  {
    "id": "2-samuel",
    "type": "book",
    "name": "2 Samuel",
    "startYear": 1010,
    "endYear": 970,
    "certainty": "approximate",
    "categories": [
      "History"
    ],
    "themes": [],
    "priority": 2,
    "author": "Gad, Nathan (traditional)",
    "description": "David reign over Israel, covenant promise, victories, and failures.",
    "sources": [
      "Hindson & Yates, The Essence of the Old Testament (B&H Academic, 2012)",
      "Walton, Chronological and Background Charts of the Old Testament (Zondervan, 1994)"
    ],
    "swimlane": 0
  },
  {
    "id": "1-kings",
    "type": "book",
    "name": "1 Kings",
    "startYear": 970,
    "endYear": 853,
    "certainty": "approximate",
    "categories": [
      "History"
    ],
    "themes": [],
    "priority": 2,
    "author": "Jeremiah (traditional)",
    "description": "Solomon reign, temple construction, and division of the kingdom.",
    "sources": [
      "Hindson & Yates, The Essence of the Old Testament (B&H Academic, 2012)",
      "Walton, Chronological and Background Charts of the Old Testament (Zondervan, 1994)"
    ],
    "swimlane": 2
  },
  {
    "id": "2-kings",
    "type": "book",
    "name": "2 Kings",
    "startYear": 853,
    "endYear": 586,
    "certainty": "approximate",
    "categories": [
      "History"
    ],
    "themes": [],
    "priority": 2,
    "author": "Jeremiah (traditional)",
    "description": "History of divided kingdoms through exile and Jerusalem destruction.",
    "sources": [
      "Hindson & Yates, The Essence of the Old Testament (B&H Academic, 2012)",
      "Walton, Chronological and Background Charts of the Old Testament (Zondervan, 1994)"
    ],
    "swimlane": 0
  },
  {
    "id": "jeremiah",
    "type": "book",
    "name": "Jeremiah",
    "startYear": 627,
    "endYear": 580,
    "certainty": "approximate",
    "categories": [
      "Major Prophets"
    ],
    "themes": [],
    "priority": 2,
    "author": "Jeremiah",
    "description": "Prophetic warnings, calls to repentance, and hope amid coming judgment.",
    "sources": [
      "Hindson & Yates, The Essence of the Old Testament (B&H Academic, 2012)",
      "Walton, Chronological and Background Charts of the Old Testament (Zondervan, 1994)"
    ],
    "swimlane": 4
  },
  {
    "id": "ezra",
    "type": "book",
    "name": "Ezra",
    "startYear": 538,
    "endYear": 457,
    "certainty": "approximate",
    "categories": [
      "History"
    ],
    "themes": [],
    "priority": 2,
    "author": "Ezra",
    "description": "Return from exile and restoration of worship and covenant life.",
    "sources": [
      "Hindson & Yates, The Essence of the Old Testament (B&H Academic, 2012)",
      "Walton, Chronological and Background Charts of the Old Testament (Zondervan, 1994)"
    ],
    "swimlane": 0
  },
  {
    "id": "nehemiah",
    "type": "book",
    "name": "Nehemiah",
    "startYear": 445,
    "endYear": 430,
    "certainty": "approximate",
    "categories": [
      "History"
    ],
    "themes": [],
    "priority": 2,
    "author": "Nehemiah",
    "description": "Rebuilding Jerusalem walls and spiritual reform in Judah.",
    "sources": [
      "Hindson & Yates, The Essence of the Old Testament (B&H Academic, 2012)",
      "Walton, Chronological and Background Charts of the Old Testament (Zondervan, 1994)"
    ],
    "swimlane": 0
  },
  {
    "id": "joshua",
    "type": "book",
    "name": "Joshua",
    "startYear": 1406,
    "endYear": 1375,
    "certainty": "approximate",
    "categories": [
      "History"
    ],
    "themes": [],
    "priority": 2,
    "author": "Joshua (traditional)",
    "description": "Conquest and settlement of the Promised Land under Joshua.",
    "sources": [
      "Hindson & Yates, The Essence of the Old Testament (B&H Academic, 2012)",
      "Walton, Chronological and Background Charts of the Old Testament (Zondervan, 1994)"
    ],
    "swimlane": 4
  },
  {
    "id": "judges",
    "type": "book",
    "name": "Judges",
    "startYear": 1375,
    "endYear": 1050,
    "certainty": "approximate",
    "categories": [
      "History"
    ],
    "themes": [],
    "priority": 2,
    "author": "Samuel (traditional)",
    "description": "Cycles of sin, oppression, and deliverance through judges.",
    "sources": [
      "Hindson & Yates, The Essence of the Old Testament (B&H Academic, 2012)",
      "Walton, Chronological and Background Charts of the Old Testament (Zondervan, 1994)"
    ],
    "swimlane": 0
  },
  {
    "id": "ruth",
    "type": "book",
    "name": "Ruth",
    "startYear": 1150,
    "endYear": 1100,
    "certainty": "approximate",
    "categories": [
      "History"
    ],
    "themes": [],
    "priority": 2,
    "author": "Samuel (traditional)",
    "description": "Story of loyalty and redemption in the time of judges.",
    "sources": [
      "Hindson & Yates, The Essence of the Old Testament (B&H Academic, 2012)",
      "Walton, Chronological and Background Charts of the Old Testament (Zondervan, 1994)"
    ],
    "swimlane": 1
  },
  {
    "id": "1-chronicles",
    "type": "book",
    "name": "1 Chronicles",
    "startYear": 1010,
    "endYear": 970,
    "certainty": "approximate",
    "categories": [
      "History"
    ],
    "themes": [],
    "priority": 2,
    "author": "Ezra (traditional)",
    "description": "Genealogies and David's reign from a priestly perspective.",
    "sources": [
      "Hindson & Yates, The Essence of the Old Testament (B&H Academic, 2012)",
      "Walton, Chronological and Background Charts of the Old Testament (Zondervan, 1994)"
    ],
    "swimlane": 1
  },
  {
    "id": "2-chronicles",
    "type": "book",
    "name": "2 Chronicles",
    "startYear": 970,
    "endYear": 586,
    "certainty": "approximate",
    "categories": [
      "History"
    ],
    "themes": [],
    "priority": 2,
    "author": "Ezra (traditional)",
    "description": "History of Judah's kings from Solomon to exile.",
    "sources": [
      "Hindson & Yates, The Essence of the Old Testament (B&H Academic, 2012)",
      "Walton, Chronological and Background Charts of the Old Testament (Zondervan, 1994)"
    ],
    "swimlane": 3
  },
  {
    "id": "esther",
    "type": "book",
    "name": "Esther",
    "startYear": 486,
    "endYear": 465,
    "certainty": "approximate",
    "categories": [
      "History"
    ],
    "themes": [],
    "priority": 2,
    "author": "Unknown",
    "description": "God's providence preserving Jews in Persian exile.",
    "sources": [
      "Hindson & Yates, The Essence of the Old Testament (B&H Academic, 2012)",